+-----------------------------------------------------------------------------
+ Started burn-in: Tue Aug 13 09:35:17 PM EDT 2024
+-----------------------------------------------------------------------------
Host:                   deepthought
OS:                     Linux
Drive:                  /dev/sde
Disk Type:              7200_rpm
Drive Model:            WDC_WUH721414ALN604
Serial Number:          X1G4EPXL
Short test duration:    2 minutes
                        120 seconds
Extended test duration: 1410 minutes
                        84600 seconds
Log file:               /root/disk-burnin-and-testing/burnin-WDC_WUH721414ALN604_X1G4EPXL.log
Bad blocks file:        /root/disk-burnin-and-testing/burnin-WDC_WUH721414ALN604_X1G4EPXL.bb
+-----------------------------------------------------------------------------
+ Running SMART short test: Tue Aug 13 09:35:17 PM EDT 2024
+-----------------------------------------------------------------------------
SMART short test started, awaiting completion for 120 seconds ...
SMART self-test succeeded
smartctl 7.3 2022-02-28 r5338 [x86_64-linux-6.8.12-1-pve] (local build)

SMART Self-test log structure revision number 1
Num  Test_Description    Status                  Remaining  LifeTime(hours)  LBA_of_first_error
# 1  Short offline       Completed without error       00%         0         -

Finished SMART short test
+-----------------------------------------------------------------------------
+ Running badblocks test: Tue Aug 13 09:37:17 PM EDT 2024
+-----------------------------------------------------------------------------
Finished badblocks test
+-----------------------------------------------------------------------------
+ Running SMART long test: Tue Aug 20 06:25:22 AM EDT 2024
+-----------------------------------------------------------------------------
SMART long test started, awaiting completion for 84600 seconds ...
SMART self-test succeeded
smartctl 7.3 2022-02-28 r5338 [x86_64-linux-6.8.12-1-pve] (local build)

SMART Self-test log structure revision number 1
Num  Test_Description    Status                  Remaining  LifeTime(hours)  LBA_of_first_error
# 1  Extended offline    Completed without error       00%       177         -
# 2  Short offline       Completed without error       00%         0         -

Finished SMART long test
+-----------------------------------------------------------------------------
+ Drive information: Wed Aug 21 06:54:22 AM EDT 2024
+-----------------------------------------------------------------------------
smartctl 7.3 2022-02-28 r5338 [x86_64-linux-6.8.12-1-pve] (local build)

=== START OF INFORMATION SECTION ===
Device Model:     WDC  WUH721414ALN604
Serial Number:    X1G4EPXL
LU WWN Device Id: 5 000cca 298c204f0
Firmware Version: LDGNW400
User Capacity:    14,000,519,643,136 bytes [14.0 TB]
Sector Size:      4096 bytes logical/physical
Rotation Rate:    7200 rpm
Form Factor:      3.5 inches
Device is:        Not in smartctl database 7.3/5319
ATA Version is:   ACS-2, ATA8-ACS T13/1699-D revision 4
SATA Version is:  SATA 3.2, 6.0 Gb/s (current: 6.0 Gb/s)
Local Time is:    Wed Aug 21 06:54:22 2024 EDT
SMART support is: Available - device has SMART capability.
SMART support is: Enabled
AAM feature is:   Unavailable
APM level is:     254 (maximum performance)
Rd look-ahead is: Enabled
Write cache is:   Enabled
DSN feature is:   Unavailable
ATA Security is:  Disabled, NOT FROZEN [SEC1]
Wt Cache Reorder: Enabled

SMART overall-health self-assessment test result: PASSED

General SMART Values:
Offline data collection status:  (0x84)	Offline data collection activity
					was suspended by an interrupting command from host.
					Auto Offline Data Collection: Enabled.
Self-test execution status:      (   0)	The previous self-test routine completed
					without error or no self-test has ever
					been run.
Total time to complete Offline
data collection: 		(  101) seconds.
Offline data collection
capabilities: 			 (0x5b) SMART execute Offline immediate.
					Auto Offline data collection on/off support.
					Suspend Offline collection upon new
					command.
					Offline surface scan supported.
					Self-test supported.
					No Conveyance Self-test supported.
					Selective Self-test supported.
SMART capabilities:            (0x0003)	Saves SMART data before entering
					power-saving mode.
					Supports SMART auto save timer.
Error logging capability:        (0x01)	Error logging supported.
					General Purpose Logging supported.
Short self-test routine
recommended polling time: 	 (   2) minutes.
Extended self-test routine
recommended polling time: 	 (1410) minutes.
SCT capabilities: 	       (0x003d)	SCT Status supported.
					SCT Error Recovery Control supported.
					SCT Feature Control supported.
					SCT Data Table supported.

ID# ATTRIBUTE_NAME          FLAGS    VALUE WORST THRESH FAIL RAW_VALUE
  1 Raw_Read_Error_Rate     PO-R--   100   100   001    -    0
  2 Throughput_Performance  P-S---   100   100   054    -    0
  3 Spin_Up_Time            POS---   099   099   001    -    77
  4 Start_Stop_Count        -O--C-   100   100   000    -    1
  5 Reallocated_Sector_Ct   PO--CK   100   100   001    -    0
  7 Seek_Error_Rate         PO-R--   100   100   001    -    0x000000000000
  8 Seek_Time_Performance   P-S---   100   100   020    -    0
  9 Power_On_Hours          -O--C-   100   100   000    -    177
 10 Spin_Retry_Count        PO--C-   100   100   001    -    0
 12 Power_Cycle_Count       -O--CK   100   100   000    -    1
 22 Unknown_Attribute       PO---K   100   100   025    -    100
192 Power-Off_Retract_Count -O--CK   100   100   000    -    5
193 Load_Cycle_Count        -O--C-   100   100   000    -    5
194 Temperature_Celsius     -O----   062   062   000    -    33 (Min/Max 25/37)
196 Reallocated_Event_Count -O--CK   100   100   000    -    0
197 Current_Pending_Sector  -O---K   100   100   000    -    0
198 Offline_Uncorrectable   ---R--   100   100   000    -    0
199 UDMA_CRC_Error_Count    -O-R--   100   100   000    -    0
                            ||||||_ K auto-keep
                            |||||__ C event count
                            ||||___ R error rate
                            |||____ S speed/performance
                            ||_____ O updated online
                            |______ P prefailure warning

General Purpose Log Directory Version 1
SMART           Log Directory Version 1 [multi-sector log support]
Address    Access  R/W   Size  Description
0x00       GPL,SL  R/O      1  Log Directory
0x01           SL  R/O      1  Summary SMART error log
0x02           SL  R/O      1  Comprehensive SMART error log
0x03       GPL     R/O      1  Ext. Comprehensive SMART error log
0x04       GPL     R/O    256  Device Statistics log
0x04       SL      R/O    255  Device Statistics log
0x06           SL  R/O      1  SMART self-test log
0x07       GPL     R/O      1  Extended self-test log
0x08       GPL     R/O      2  Power Conditions log
0x09           SL  R/W      1  Selective self-test log
0x0c       GPL     R/O    688  Pending Defects log
0x10       GPL     R/O      1  NCQ Command Error log
0x11       GPL     R/O      1  SATA Phy Event Counters log
0x12       GPL     R/O      1  SATA NCQ Non-Data log
0x13       GPL     R/O      1  SATA NCQ Send and Receive log
0x15       GPL     R/W      1  Rebuild Assist log
0x21       GPL     R/O      1  Write stream error log
0x22       GPL     R/O      1  Read stream error log
0x24       GPL     R/O    256  Current Device Internal Status Data log
0x25       GPL     R/O    256  Saved Device Internal Status Data log
0x2f       GPL     -        1  Set Sector Configuration
0x30       GPL,SL  R/O      9  IDENTIFY DEVICE data log
0x80-0x9f  GPL,SL  R/W     16  Host vendor specific log
0xe0       GPL,SL  R/W      1  SCT Command/Status
0xe1       GPL,SL  R/W      1  SCT Data Transfer

SMART Extended Comprehensive Error Log Version: 1 (1 sectors)
No Errors Logged

SMART Extended Self-test Log Version: 1 (1 sectors)
Num  Test_Description    Status                  Remaining  LifeTime(hours)  LBA_of_first_error
# 1  Extended offline    Completed without error       00%       177         -
# 2  Short offline       Completed without error       00%         0         -

SMART Selective self-test log data structure revision number 1
 SPAN  MIN_LBA  MAX_LBA  CURRENT_TEST_STATUS
    1        0        0  Not_testing
    2        0        0  Not_testing
    3        0        0  Not_testing
    4        0        0  Not_testing
    5        0        0  Not_testing
Selective self-test flags (0x0):
  After scanning selected spans, do NOT read-scan remainder of disk.
If Selective self-test is pending on power-up, resume after 0 minute delay.

SCT Status Version:                  3
SCT Version (vendor specific):       256 (0x0100)
Device State:                        SMART Off-line Data Collection executing in background (4)
Current Temperature:                    33 Celsius
Power Cycle Min/Max Temperature:     25/37 Celsius
Lifetime    Min/Max Temperature:     25/37 Celsius
Under/Over Temperature Limit Count:   0/0
SMART Status:                        0xc24f (PASSED)
Minimum supported ERC Time Limit:    65 (6.5 seconds)

SCT Temperature History Version:     2
Temperature Sampling Period:         1 minute
Temperature Logging Interval:        1 minute
Min/Max recommended Temperature:      0/60 Celsius
Min/Max Temperature Limit:           -40/70 Celsius
Temperature History Size (Index):    128 (19)

Index    Estimated Time   Temperature Celsius
  20    2024-08-21 04:47    33  **************
 ...    ..(  2 skipped).    ..  **************
  23    2024-08-21 04:50    33  **************
  24    2024-08-21 04:51    34  ***************
 ...    ..(  3 skipped).    ..  ***************
  28    2024-08-21 04:55    34  ***************
  29    2024-08-21 04:56    33  **************
  30    2024-08-21 04:57    33  **************
  31    2024-08-21 04:58    33  **************
  32    2024-08-21 04:59    34  ***************
 ...    ..(  2 skipped).    ..  ***************
  35    2024-08-21 05:02    34  ***************
  36    2024-08-21 05:03    33  **************
 ...    ..(  4 skipped).    ..  **************
  41    2024-08-21 05:08    33  **************
  42    2024-08-21 05:09    34  ***************
  43    2024-08-21 05:10    34  ***************
  44    2024-08-21 05:11    33  **************
 ...    ..( 14 skipped).    ..  **************
  59    2024-08-21 05:26    33  **************
  60    2024-08-21 05:27    34  ***************
  61    2024-08-21 05:28    34  ***************
  62    2024-08-21 05:29    33  **************
 ...    ..( 84 skipped).    ..  **************
  19    2024-08-21 06:54    33  **************

SCT Error Recovery Control:
           Read: Disabled
          Write: Disabled

Device Statistics (GP Log 0x04)
Page  Offset Size        Value Flags Description
0x01  =====  =               =  ===  == General Statistics (rev 1) ==
0x01  0x008  4               1  ---  Lifetime Power-On Resets
0x01  0x010  4             177  ---  Power-on Hours
0x01  0x018  6     13672382464  ---  Logical Sectors Written
0x01  0x020  6       106815488  ---  Number of Write Commands
0x01  0x028  6     13685743051  ---  Logical Sectors Read
0x01  0x030  6       107233188  ---  Number of Read Commands
0x01  0x038  6       639627600  ---  Date and Time TimeStamp
0x03  =====  =               =  ===  == Rotating Media Statistics (rev 1) ==
0x03  0x008  4             177  ---  Spindle Motor Power-on Hours
0x03  0x010  4             177  ---  Head Flying Hours
0x03  0x018  4               5  ---  Head Load Events
0x03  0x020  4               0  ---  Number of Reallocated Logical Sectors
0x03  0x028  4               0  ---  Read Recovery Attempts
0x03  0x030  4               1  ---  Number of Mechanical Start Failures
0x04  =====  =               =  ===  == General Errors Statistics (rev 1) ==
0x04  0x008  4               0  ---  Number of Reported Uncorrectable Errors
0x04  0x010  4               0  ---  Resets Between Cmd Acceptance and Completion
0x04  0x018  4               0  ---  Physical Element Status Changed
0x05  =====  =               =  ===  == Temperature Statistics (rev 1) ==
0x05  0x008  1              33  ---  Current Temperature
0x05  0x010  1              33  N--  Average Short Term Temperature
0x05  0x018  1               -  N--  Average Long Term Temperature
0x05  0x020  1              37  ---  Highest Temperature
0x05  0x028  1              25  ---  Lowest Temperature
0x05  0x030  1              36  N--  Highest Average Short Term Temperature
0x05  0x038  1              25  N--  Lowest Average Short Term Temperature
0x05  0x040  1               -  N--  Highest Average Long Term Temperature
0x05  0x048  1               -  N--  Lowest Average Long Term Temperature
0x05  0x050  4               0  ---  Time in Over-Temperature
0x05  0x058  1              60  ---  Specified Maximum Operating Temperature
0x05  0x060  4               0  ---  Time in Under-Temperature
0x05  0x068  1               0  ---  Specified Minimum Operating Temperature
0x06  =====  =               =  ===  == Transport Statistics (rev 1) ==
0x06  0x008  4               3  ---  Number of Hardware Resets
0x06  0x010  4               0  ---  Number of ASR Events
0x06  0x018  4               0  ---  Number of Interface CRC Errors
0xff  =====  =               =  ===  == Vendor Specific Statistics (rev 1) ==
                                |||_ C monitored condition met
                                ||__ D supports DSN
                                |___ N normalized value

Pending Defects log (GP Log 0x0c)
No Defects Logged

SATA Phy Event Counters (GP Log 0x11)
ID      Size     Value  Description
0x0001  2            0  Command failed due to ICRC error
0x0002  2            0  R_ERR response for data FIS
0x0003  2            0  R_ERR response for device-to-host data FIS
0x0004  2            0  R_ERR response for host-to-device data FIS
0x0005  2            0  R_ERR response for non-data FIS
0x0006  2            0  R_ERR response for device-to-host non-data FIS
0x0007  2            0  R_ERR response for host-to-device non-data FIS
0x0008  2            0  Device-to-host non-data FIS retries
0x0009  2        65535+ Transition from drive PhyRdy to drive PhyNRdy
0x000a  2            2  Device-to-host register FISes sent due to a COMRESET
0x000b  2            0  CRC errors within host-to-device FIS
0x000d  2            0  Non-CRC errors within host-to-device FIS

+-----------------------------------------------------------------------------
+ Finished burn-in: Wed Aug 21 06:54:23 AM EDT 2024
+-----------------------------------------------------------------------------